<?xml version="1.0" encoding="utf-8"?>
<xsd:schema attributeFormDefault="unqualified" elementFormDefault="qualified" version="1.0" xmlns:xsd="http://www.w3.org/2001/XMLSchema">
  <xsd:element name="comparators-list" type="comparators-listType" />
  <xsd:complexType name="comparators-listType">
    <xsd:sequence>
      <xsd:element name="group" type="groupType" minOccurs="1" maxOccurs="unbounded"/>
    </xsd:sequence>
  </xsd:complexType>
  <xsd:complexType name="groupType">
    <xsd:sequence>
      <xsd:element name="comparator" type="comparatorType" minOccurs="1" maxOccurs="unbounded"/>
    </xsd:sequence>
    <xsd:attribute name="description" type="xsd:string" />
    <xsd:attribute name="path" type="xsd:string" />
  </xsd:complexType>
  <xsd:complexType name="comparatorType">
    <xsd:sequence>
      <xsd:element name="className" type="xsd:string" minOccurs="1" maxOccurs="1"/>
      <xsd:element name="codes" type="codesType" minOccurs="1"/>
      <xsd:element name="params" type="paramsType" minOccurs="0"/>
      <xsd:element name="data-sources" type="data-sourcesType" minOccurs="0"/>
      <xsd:element name="dependency-classes" type="dependClasses" minOccurs="0"/>
      <xsd:element name="curve-adjust" type="curveAdjust" minOccurs="0"/>
    </xsd:sequence>
    <xsd:attribute name="description" type="xsd:string" />
  </xsd:complexType>
  <xsd:complexType name="data-sourcesType">
    <xsd:sequence>
      <xsd:element name="data-source" type="data-sourceType" minOccurs="0" maxOccurs="unbounded"/>
    </xsd:sequence>
  </xsd:complexType>
  <xsd:complexType name="data-sourceType">
    <xsd:attribute name="description" type="xsd:string" />
    <xsd:attribute name="name" type="xsd:string" />
    <xsd:attribute name="type" type="xsd:string" />
  </xsd:complexType>
  <xsd:complexType name="paramsType">
    <xsd:sequence>
      <xsd:element minOccurs="0" maxOccurs="unbounded" name="param" type="paramType" />
    </xsd:sequence>
  </xsd:complexType>
  <xsd:complexType name="codesType">
    <xsd:sequence>
      <xsd:element minOccurs="1" maxOccurs="unbounded" name="code" type="codeType" />
    </xsd:sequence>
  </xsd:complexType>  
  <xsd:complexType name="dependClasses">
    <xsd:sequence>
      <xsd:element minOccurs="0" maxOccurs="unbounded" name="dependency-class" type="classType" />
    </xsd:sequence>
  </xsd:complexType>  
  <xsd:complexType name="curveAdjust">
    <xsd:attribute name="status"/>
  </xsd:complexType>    
  <xsd:complexType name="paramType">
    <xsd:attribute name="description" type="xsd:string" />
    <xsd:attribute name="name" type="xsd:string" />
    <xsd:attribute name="type" type="xsd:string" />
  </xsd:complexType>
  <xsd:complexType name="codeType">
    <xsd:attribute name="description" type="xsd:string" />
    <xsd:attribute name="name" type="xsd:string" />
  </xsd:complexType>  
  <xsd:complexType name="classType">
    <xsd:attribute name="matchfield" type="xsd:string"/>
    <xsd:attribute name="name" type="xsd:string"/>
  </xsd:complexType> 
</xsd:schema>