<?xml version="1.0" encoding="UTF-8"?>
<comparators-list xmlns:xsi="http://www.w3.org/2001/XMLSchema-instance" xsi:noNamespaceSchemaLocation="comparatorsList.xsd">
    <group description="Original group of comparators" path="com.sun.mdm.matcher.comparators.base">
        <comparator description="Simple Bigram Comparator">
            <className>BigramComparator</className>
            <codes>
                <code description="Bigram comparator" name="b1" />
            </codes>
            <params/>           
            <data-sources/>
        </comparator>
        <comparator description="Advanced Bigram Comparator">
            <className>AdvancedBigramComparator</className>
            <codes>
                <code description="Advanced Bigram comparator" name="b2" />
            </codes>
            <params/>          
            <data-sources/>
        </comparator>  
        <comparator description="Condensed String comparator">
            <className>CondensedStringComparator</className>
            <codes>            
                <code description="Condensed String comparator" name="us"/>
            </codes>   
            <params/>                            
            <data-sources/>
        </comparator>              
        <comparator description="Condensed AlphaNumeric comparator">
            <className>CondensedSSNComparator</className>
            <codes>            
               <code description="Condensed AlphaNumeric SSN comparator" name="nS" />
            </codes>   
             <params>
                <param description="Fixed length option" name="ssnLength" type="java.lang.Integer"/>
                <param description="record type" name="recType" type="java.lang.String"/>   
                <param description="List of SSN patterns" name="ssnList" type="java.lang.Character"/>                   
            </params>                                    
            <data-sources/>
        </comparator>              
        <comparator description="Date comparator">
            <className>DateComparator</className>
            <codes>
               <code description="Date comparator with days as units"  name="d" /> 
               <code description="Date comparator with days as units"  name="dD" /> 
               <code description="Date comparator with months as units" name="dM" /> 
               <code description="Date comparator with years as units" name="dY" /> 
               <code description="Date comparator with hours as units" name="dH" /> 
               <code description="Date comparator with minutes as units" name="dm" /> 
               <code description="Date comparator with seconds as units" name="ds"/> 
            </codes>
            <params>
               <param description="Methods choice option" name="switch" type="java.lang.String"/>
               <param description="lower limit" name="lLimit" type="java.lang.Integer"/>   
               <param description="upper limit" name="uLimit" type="java.lang.Integer"/>                   
            </params>               
            <data-sources/>
            <dependency-classes>
               <dependency-class description="The first dep-class" name="com.sun.mdm.matcher.comparators.base.JaroAdvancedSSNComparator"/>
            </dependency-classes>
        </comparator>   
        <comparator description="Advanced Jaro string comparator">
            <className>JaroAdvancedStringComparator</className>
            <codes>            
               <code description="Advanced Jaro String Comparator" name="u" />
               <code description="Advanced Jaro Adjusted for first names" name="uf" />
               <code description="Advanced Jaro Adjusted for last names" name="ul" />
               <code description="Advanced Jaro numbers" name="un" />
            </codes>   
            <params/>                            
            <data-sources/>
        </comparator>       
        <comparator description="Advanced Jaro SSN comparator">
            <className>JaroAdvancedSSNComparator</className>
            <codes>            
               <code description="Advanced Jaro AlphaNumeric Comparator" name="uan" />
            </codes>   
             <params>
                <param description="Fixed length option" name="ssnLength" type="java.lang.Integer"/>
                <param description="record type" name="recType" type="java.lang.String"/>   
                <param description="List of SSN patterns" name="ssnList" type="java.lang.Character"/>                   
            </params>                                  
            <data-sources/>
        </comparator>   
        <comparator description="Numerics comparator">
            <className>NumericsComparator</className>
            <codes>            
               <code description="Real numbers comparator" name="n[R, ]"/>
               <code description="Integers comparator" name="nI" />
            </codes>   
             <params>
               <param description="distance/string comparison option" name="switch" type="java.lang.String"/>
               <param description="Spectrum of comparison" name="range" type="java.lang.Integer"/>              
            </params>                                  
            <data-sources/>
        </comparator>            
        <comparator description="Unicode SSN comparator">
            <className>UnicodeSSNComparator</className>
            <codes>            
               <code description="The unicode AlphaNumeric Comparator" name="usus" />
            </codes>   
             <params>
                <param description="Fixed length option" name="ssnLength" type="java.lang.Integer"/>
                <param description="record type" name="recType" type="java.lang.String"/>   
                <param description="List of SSN patterns" name="ssnList" type="java.lang.Character"/>                   
            </params>                                  
            <data-sources/>
        </comparator>  
        <comparator description="Unicode string comparator">
            <className>UnicodeStringComparator</className>
            <codes>            
               <code description="Unicode String Comparator" name="usu" />
            </codes>   
             <params>
                <param description="Language used" name="language" type="java.lang.String"/>       
            </params>                                      
            <data-sources/>
        </comparator>    
        <comparator description="Winkler-Jaro string comparator">
            <className>WinklerJaroStringComparator</className>
            <codes>            
               <code description="Winkler-Jaro string comparator" name="ua" />
            </codes>   
            <params/>                            
            <data-sources/>
        </comparator> 
        <comparator description="Exact comparator">
            <className>ExactComparator</className>
            <codes>            
               <code description="Exact character-to-character comparator" name="c" />
            </codes>   
            <params/>                            
            <data-sources/>
        </comparator>  
        <comparator description="Prorated comparator">
            <className>ProratedComparator</className>
            <codes>            
               <code description="Prorated comparator" name="p" />
            </codes>   
            <params>
                <param description="The range" name="range" type="java.lang.Integer"/>
                <param description="First tolerance" name="tolerance1" type="java.lang.Integer"/>   
                <param description="Second tolerance" name="tolerance2" type="java.lang.Integer"/>                   
            </params>                         
            <data-sources/>
        </comparator>                 
    </group>
    <group description="Group of test comparators" path="com.sun.mdm.matcher.comparators.addon">
        <comparator description="A test comparator">
            <className>NewStringComparator</className>
            <codes>                
                <code description="The x1" name="x1" />
                <code description="The x2" name="x2" />
                <code description="The x3" name="x3" />
            </codes>    
            <params>
                <param description="Param 1" name="param1" type="java.lang.Integer"/>
                <param description="Param 2" name="param2" type="java.lang.Integer"/>   
                <param description="Param 3" name="param3" type="java.lang.Integer"/>                   
            </params>              
            <data-sources/>                  
        </comparator>
    </group>
</comparators-list>