<?xml version="1.0" encoding="UTF-8"?>
<comparators-list xmlns:xsi="http://www.w3.org/2001/XMLSchema-instance" xsi:noNamespaceSchemaLocation="schema/comparatorsList.xsd">
    <group description="Original group of comparators" path="com.sun.mdm.matcher.comparators.base">
        <comparator description="Simple Bigram Comparator">
            <className>BigramComparator</className>
            <codes>
                <code description="Bigram Comparator" name="b1" />
            </codes>
        </comparator>
        <comparator description="Advanced Bigram Comparator">
            <className>AdvancedBigramComparator</className>
            <codes>
                <code description="Advanced Bigram Comparator" name="b2" />
            </codes>
        </comparator>  
        <comparator description="Condensed String comparator">
            <className>CondensedStringComparator</className>
            <codes>            
                <code description="Condensed String Comparator" name="us"/>
            </codes>   
        </comparator>              
        <comparator description="Condensed AlphaNumeric comparator">
            <className>CondensedSSNComparator</className>
            <codes>            
               <code description="Condensed AlphaNumeric SSN Comparator" name="nS" />
            </codes>   
             <params>
                <param description="Fixed length option" name="ssnLength" type="java.lang.Integer"/>
                <param description="record type(Numeric(nu)/Alpha-Numeric(an))" name="recType" type="java.lang.String"/>   
                <param description="List of SSN excluded character patterns" name="ssnList" type="java.lang.Character[]"/>                   
            </params>                                    
            <data-sources/>
        </comparator>              
        <comparator description="Date comparator">
            <className>DateComparator</className>
            <codes>
               <code description="Date Comparator With Days as Units"  name="d[D, ]" /> 
               <code description="Date Comparator With Months as Units" name="dM" /> 
               <code description="Date Comparator With Years as Units" name="dY" /> 
               <code description="Date Comparator With Hours as Units" name="dH" /> 
               <code description="Date Comparator With Minutes as Units" name="dm" /> 
               <code description="Date Comparator With Seconds as Units" name="ds"/> 
            </codes>
            <params>
               <param description="Methods choice option" name="switch" type="java.lang.String"/>
               <param description="lower limit" name="lLimit" type="java.lang.Integer"/>   
               <param description="upper limit" name="uLimit" type="java.lang.Integer"/>                   
            </params>               
            <data-sources/>
            <dependency-classes>
               <dependency-class matchfield="String" name="com.sun.mdm.matcher.comparators.base.JaroAdvancedSSNComparator"/>
            </dependency-classes>
        </comparator>   
        <comparator description="Advanced Jaro string comparator">
            <className>JaroAdvancedStringComparator</className>
            <codes>            
               <code description="Advanced Jaro String Comparator" name="u" />
               <code description="Advanced Jaro Adjusted for First Names" name="uf" />
               <code description="Advanced Jaro Adjusted for Last Names" name="ul" />
               <code description="Advanced Jaro Adjusted for House Numbers" name="un" />
            </codes>   
            <params/>                            
            <data-sources/>
            <dependency-classes/>
            <curve-adjust status="true"/>
        </comparator>       
        <comparator description="Advanced Jaro SSN comparator">
            <className>JaroAdvancedSSNComparator</className>
            <codes>            
               <code description="Advanced Jaro AlphaNumeric Comparator" name="ujs" />
            </codes>   
             <params>
                <param description="Fixed length option" name="ssnLength" type="java.lang.Integer"/>
                <param description="record type" name="recType" type="java.lang.String"/>   
                <param description="List of SSN excluded character patterns" name="ssnList" type="java.lang.Character[]"/>                   
            </params>                                  
            <data-sources/>
            <dependency-classes/>
        </comparator>   
        <comparator description="Numerics comparator">
            <className>NumericsComparator</className>
            <codes>            
               <code description="Real Number Comparator" name="n[R, ]"/>
               <code description="Integer Comparator" name="nI" />
            </codes>   
             <params>
               <param description="distance/string comparison option" name="switch" type="java.lang.String"/>
               <param description="Spectrum of comparison" name="range" type="java.lang.Integer|java.lang.Double"/>              
            </params>                                  
            <data-sources/>
            <dependency-classes>
                <dependency-class matchfield="CSC" name="com.sun.mdm.matcher.comparators.base.CondensedStringComparator"/>               
            </dependency-classes>
            <curve-adjust status="false"/>
        </comparator>            
        <comparator description="Unicode SSN comparator">
            <className>UnicodeSSNComparator</className>
            <codes>            
               <code description="Unicode AlphaNumeric Comparator" name="usus" />
            </codes>   
             <params>
                <param description="Language used" name="language" type="java.lang.String"/>    
                <param description="Fixed length option" name="ssnLength" type="java.lang.Integer"/>
                <param description="record type" name="recType" type="java.lang.String"/>   
                <param description="List of SSN excluded character patterns" name="ssnList" type="java.lang.Character[]"/>                   
            </params>                                  
            <data-sources/>
        </comparator>  
        <comparator description="Unicode string comparator">
            <className>UnicodeStringComparator</className>
            <codes>            
               <code description="Unicode String Comparator" name="usu" />
            </codes>   
             <params>
                <param description="Language used" name="language" type="java.lang.String"/>       
            </params>                                      
            <data-sources/>
        </comparator>    
        <comparator description="Winkler-Jaro string comparator">
            <className>WinklerJaroStringComparator</className>
            <codes>            
               <code description="Winkler-Jaro String Comparator" name="ua" />
            </codes>   
            <params/>                            
            <data-sources/>
            <curve-adjust status="true"/>
        </comparator> 
        <comparator description="Exact comparator">
            <className>ExactComparator</className>
            <codes>            
               <code description="Exact Character-to-Character Comparator" name="c" />
            </codes>   
            <params/>                            
            <data-sources/>
        </comparator>  
        <comparator description="Prorated comparator">
            <className>ProratedComparator</className>
            <codes>            
               <code description="Prorated Comparator" name="p" />
            </codes>   
            <params>
                <param description="The range" name="range" type="java.lang.Integer"/>
                <param description="First tolerance" name="tolerance1" type="java.lang.Integer"/>   
                <param description="Second tolerance" name="tolerance2" type="java.lang.Integer"/>                   
            </params>                         
            <data-sources/>
        </comparator>                 
    </group>
</comparators-list>